<?xml version="1.0"?>
<!DOCTYPE WV-CSP-Message PUBLIC "-//OMA//DTD WV-CSP 1.1//EN" "/home/ricky/NetBeansProjects/wbxml-stream/dtd/wv-csp_1_1.dtd">
<WV-CSP-Message>
   <Session>
      <SessionDescriptor>
         <SessionType>Inband</SessionType>

         <SessionID>im.user.com#48815@server.com</SessionID>
      </SessionDescriptor>

      <Transaction>
         <TransactionDescriptor>
            <TransactionMode>Request</TransactionMode>

            <TransactionID>IMApp01#12345@NOK5110</TransactionID>
         </TransactionDescriptor>

         <TransactionContent>
            <Invite-Request>
               <InviteID>0x38382025</InviteID>

               <InviteType>GR</InviteType>

               <Recipient>
                  <User>
                     <UserID>wv:he@there.com</UserID>
                  </User>

                  <User>
                     <UserID>wv:she@there.com</UserID>
                  </User>

                  <Group>
                     <ScreenName>
                        <SName>Johnny</SName>

                        <GroupID>wv:john/partygroup@there.com</GroupID>
                     </ScreenName>
                  </Group>
               </Recipient>

               <GroupID>wv:john/partygroup@there.com</GroupID>

               <InviteNote>Come to party! You have 10 minutes!</InviteNote>

               <ScreenName>
                  <SName>WV</SName>

                  <GroupID>wv:john/partygroup@there.com</GroupID>
               </ScreenName>

               <Validity>600</Validity>
            </Invite-Request>
         </TransactionContent>
      </Transaction>
   </Session>
</WV-CSP-Message>

