<?xml version="1.0"?>
<!DOCTYPE WV-CSP-Message PUBLIC "-//OMA//DTD WV-CSP 1.1//EN" "/home/ricky/NetBeansProjects/wbxml-stream/dtd/wv-csp_1_1.dtd">
<WV-CSP-Message>
   <Session>
      <SessionDescriptor>
         <SessionType>Inband</SessionType>

         <SessionID>im.user.com#48815@server.com</SessionID>
      </SessionDescriptor>

      <Transaction>
         <TransactionDescriptor>
            <TransactionMode>Request</TransactionMode>

            <TransactionID>IMApp01#12345@NOK5110</TransactionID>
         </TransactionDescriptor>

         <TransactionContent>
            <GetMessageList-Request>
               <GroupID>wv:john/chatgroup@there.com</GroupID>

               <MessageCount>5</MessageCount>
            </GetMessageList-Request>
         </TransactionContent>
      </Transaction>
   </Session>
</WV-CSP-Message>

