<?xml version="1.0"?>
<!DOCTYPE WV-CSP-Message PUBLIC "-//OMA//DTD WV-CSP 1.1//EN" "/home/ricky/NetBeansProjects/wbxml-stream/dtd/wv-csp_1_1.dtd">
<WV-CSP-Message>
   <Session>
      <SessionDescriptor>
         <SessionType>Inband</SessionType>

         <SessionID>im.user.com#48815@server.com</SessionID>
      </SessionDescriptor>

      <Transaction>
         <TransactionDescriptor>
         <TransactionMode>Request</TransactionMode>

         <TransactionID />

         The Wireless Village initiative: CSP DTD and examples v1.1 WV-023</TransactionDescriptor>

         <TransactionContent>
            <Polling-Request />
         </TransactionContent>
      </Transaction>
   </Session>
</WV-CSP-Message>

