<?xml version="1.0"?>
<!DOCTYPE WV-CSP-Message PUBLIC "-//OMA//DTD WV-CSP 1.1//EN" "/home/ricky/NetBeansProjects/wbxml-stream/dtd/wv-csp_1_1.dtd">
<WV-CSP-Message>
   <Session>
      <SessionDescriptor>
         <SessionType>Outband</SessionType>
      </SessionDescriptor>

      <Transaction>
         <TransactionDescriptor>
            <TransactionMode>Request</TransactionMode>

            <TransactionID>IMApp01#12345@NOK5110</TransactionID>
         </TransactionDescriptor>

         <TransactionContent>
            <GetSPInfo-Request>
               <ClientID>
                  <URL>http://206.226.10.25:80/IMPSAPP</URL>
               </ClientID>
            </GetSPInfo-Request>
         </TransactionContent>
      </Transaction>
   </Session>
</WV-CSP-Message>

