<?xml version="1.0"?>
<!DOCTYPE WV-CSP-Message PUBLIC "-//OMA//DTD WV-CSP 1.1//EN" "/home/ricky/NetBeansProjects/wbxml-stream/dtd/wv-csp_1_1.dtd">
<WV-CSP-Message>
   <Session>
      <SessionDescriptor>
         <SessionType>Inband</SessionType>

         <SessionID>im.user.com#48815@server.com</SessionID>
      </SessionDescriptor>

      <Transaction>
         <TransactionDescriptor>
            <TransactionMode>Response</TransactionMode>

            <TransactionID>IMApp01#12345@NOK5110</TransactionID>
         </TransactionDescriptor>

         <TransactionContent>
            <Status>
               <Result>
                  <Code>200</Code>

                  <Description>Successfully completed.</Description>
               </Result>
            </Status>
         </TransactionContent>
      </Transaction>
   </Session>
</WV-CSP-Message>

