<?xml version="1.0"?>
<!DOCTYPE WV-CSP-Message PUBLIC "-//OMA//DTD WV-CSP 1.1//EN" "/home/ricky/NetBeansProjects/wbxml-stream/dtd/wv-csp_1_1.dtd">
<WV-CSP-Message>
   <Session>
      <SessionDescriptor>
         <SessionType>Inband</SessionType>

         <SessionID>im.user.com#48815@server.com</SessionID>
      </SessionDescriptor>

      <Transaction>
         <TransactionDescriptor>
            <TransactionMode>Request</TransactionMode>

            <TransactionID>IMApp01#12346@NOK5110</TransactionID>
         </TransactionDescriptor>

         <TransactionContent>
            <Search-Request>
               <!-- EXPECTED ::= 595760001 -->
               <SearchID>595760001</SearchID>

               <SearchIndex>6</SearchIndex>
            </Search-Request>
         </TransactionContent>
      </Transaction>
   </Session>
</WV-CSP-Message>

